{
  "schema": "ai-sdlc-flow-selectors/v1",
  "roles": [
    {"id": "business-analyst", "label": "Business Analyst", "aliases": ["ba", "analyst"]},
    {"id": "product-manager", "label": "Product Manager", "aliases": ["pm", "product"]},
    {"id": "software-architect", "label": "Software Architect", "aliases": ["architect", "architecture"]},
    {"id": "software-engineer", "label": "Software Engineer", "aliases": ["engineer", "developer", "dev"]},
    {"id": "qa-engineer", "label": "QA Engineer", "aliases": ["qa", "tester"]}
  ],
  "actions": [
    {"id": "commit", "code": "COMMIT", "skill": "ai-sdlc-commit-prep", "role": "software-engineer", "workspace": "implementation", "stage": "commit_prep", "step": "steps/complete.md"},
    {"id": "implementation", "code": "BUILD", "skill": "ai-sdlc-sdd", "role": "software-engineer", "workspace": "implementation", "stage": "sdd", "step": "steps/execute.md"},
    {"id": "new_refinement", "code": "DISCOVER", "skill": "ai-sdlc-working-backwards-discovery", "role": "business-analyst", "workspace": "refinement", "stage": "discovery", "step": "steps/execute.md"},
    {"id": "qa_planning", "code": "QA-PLAN", "skill": "ai-sdlc-qa-requirements-gap-review", "role": "qa-engineer", "workspace": "refinement", "stage": "qa_gap_review", "step": "steps/validate.md"},
    {"id": "review", "code": "REVIEW", "skill": "ai-sdlc-code-review", "role": "software-engineer", "workspace": "implementation", "stage": "code_review", "step": "steps/validate.md"},
    {"id": "security_review", "code": "SECURITY", "skill": "ai-sdlc-security-testing", "role": "software-architect", "workspace": "implementation", "stage": "security_testing", "step": "steps/validate.md"},
    {"id": "story_decomposition", "code": "PLAN", "skill": "ai-sdlc-user-story-decomposition", "role": "product-manager", "workspace": "refinement", "stage": "story_decomposition", "step": "steps/handoff.md"},
    {"id": "validation", "code": "VALIDATE", "skill": "ai-sdlc-validation", "role": "qa-engineer", "workspace": "implementation", "stage": "validation", "step": "steps/validate.md"},
    {"id": "branching", "code": "BRANCH", "skill": "ai-sdlc-branching", "role": "software-engineer", "workspace": "implementation", "stage": "branching", "step": "steps/execute.md"}
  ],
  "selectors": [
    {
      "id": "route-contract",
      "roles": [],
      "actions": [],
      "include": ["references/flow-contract.md"],
      "priority": 100,
      "max_tokens": 1600,
      "reason": "stable DecisionCard and Explore/Apply boundary"
    }
  ]
}
